{
  "schemaVersion": 1,
  "name": "cat",
  "description": "Concatenate and print files",
  "options": [
    {
      "name": "-b",
      "description": "Number the non-blank output lines, starting at 1",
      "takesValue": false
    },
    {
      "name": "-e",
      "description": "Display non-printing characters (see the -v option), and display a dollar sign (‘$’) at the end of each line",
      "takesValue": false
    },
    {
      "name": "-l",
      "description": "Set an exclusive advisory lock on the standard output file descriptor.  This lock is set using fcntl(2) with the F_SETLKW command. If the output file is already locked, cat will block until the lock is acquired",
      "takesValue": false
    },
    {
      "name": "-n",
      "description": "Number the output lines, starting at 1",
      "takesValue": false
    },
    {
      "name": "-s",
      "description": "Squeeze multiple adjacent empty lines, causing the output to be single spaced",
      "takesValue": false
    },
    {
      "name": "-t",
      "description": "Display non-printing characters (see the -v option), and display tab characters as ‘^I’",
      "takesValue": false
    },
    {
      "name": "-u",
      "description": "Disable output buffering",
      "takesValue": false
    },
    {
      "name": "-v",
      "description": "Display non-printing characters so they are visible.  Control characters print as ‘^X’ for control-X; the delete character (octal 0177) prints as ‘^?’.  Non-ASCII characters (with the high bit set) are printed as ‘M-’ (for meta) followed by the character for the low 7 bits",
      "takesValue": false
    }
  ],
  "args": [
    {
      "name": "argument",
      "isVariadic": true,
      "template": "filepaths"
    }
  ]
}
