{
  "schemaVersion": 1,
  "name": "mkdir",
  "description": "Make directories",
  "options": [
    {
      "name": "-m",
      "description": "Set file mode (as in chmod), not a=rwx - umask",
      "takesValue": true,
      "args": [
        {
          "name": "mode"
        }
      ]
    },
    {
      "name": "--mode",
      "description": "Set file mode (as in chmod), not a=rwx - umask",
      "takesValue": true,
      "args": [
        {
          "name": "mode"
        }
      ]
    },
    {
      "name": "-p",
      "description": "No error if existing, make parent directories as needed",
      "takesValue": false
    },
    {
      "name": "--parents",
      "description": "No error if existing, make parent directories as needed",
      "takesValue": false
    },
    {
      "name": "-v",
      "description": "Print a message for each created directory",
      "takesValue": false
    },
    {
      "name": "--verbose",
      "description": "Print a message for each created directory",
      "takesValue": false
    },
    {
      "name": "-Z",
      "description": "Set the SELinux security context of each created directory",
      "takesValue": true,
      "args": [
        {
          "name": "context"
        }
      ]
    },
    {
      "name": "--context",
      "description": "Set the SELinux security context of each created directory",
      "takesValue": true,
      "args": [
        {
          "name": "context"
        }
      ]
    },
    {
      "name": "--help",
      "description": "Display this help and exit",
      "takesValue": false
    },
    {
      "name": "--version",
      "description": "Output version information and exit",
      "takesValue": false
    }
  ],
  "args": [
    {
      "name": "directory name",
      "template": "folders"
    }
  ]
}
