{
  "schemaVersion": 1,
  "name": "ruby",
  "description": "Interpreted object-oriented scripting language",
  "options": [
    {
      "name": "--copyright",
      "description": "Prints the copyright notice",
      "takesValue": false
    },
    {
      "name": "--version",
      "description": "Prints the version of Ruby interpreter",
      "takesValue": false
    },
    {
      "name": "-0",
      "description": "Specifies the input record separator ($/) as an octal number",
      "takesValue": true,
      "args": [
        {
          "name": "octal"
        }
      ]
    },
    {
      "name": "-C",
      "description": "Causes Ruby to switch to the directory",
      "takesValue": true,
      "args": [
        {
          "name": "directory",
          "template": "folders"
        }
      ]
    },
    {
      "name": "-F",
      "description": "Specifies input field separator ($;)",
      "takesValue": true,
      "args": [
        {
          "name": "pattern"
        }
      ]
    },
    {
      "name": "-I",
      "description": "Used to tell Ruby where to load the library scripts. Directory path will be added to the load-path variable ($:)",
      "takesValue": true,
      "args": [
        {
          "name": "directory",
          "template": "folders"
        }
      ]
    },
    {
      "name": "-K",
      "description": "Specifies KANJI (Japanese) encoding",
      "takesValue": true,
      "args": [
        {
          "name": "kcode"
        }
      ]
    },
    {
      "name": "-S",
      "description": "Makes Ruby use the PATH environment variable to search for script, unless its name begins with a slash. This is used to emulate #! on machines that don't support it, in the following manner: #! /usr/local/bin/ruby # This line makes the next one a comment in Ruby \\ exec /usr/local/bin/ruby -S $0 $*",
      "takesValue": false
    },
    {
      "name": "-T",
      "description": "Turns on taint checks at the specified level (default 1)",
      "takesValue": true,
      "args": [
        {
          "name": "level"
        }
      ]
    },
    {
      "name": "-a",
      "description": "Turns on auto-split mode when used with -n or -p",
      "takesValue": false
    },
    {
      "name": "-c",
      "description": "Causes Ruby to check the syntax of the script and exit without executing. If there are no syntax errors, Ruby will print “Syntax OK” to the standard output",
      "takesValue": false
    },
    {
      "name": "-d",
      "description": "Turns on debug mode. $DEBUG will be set to true",
      "takesValue": false
    },
    {
      "name": "--debug",
      "description": "Turns on debug mode. $DEBUG will be set to true",
      "takesValue": false
    },
    {
      "name": "-e",
      "description": "Specifies script from command-line while telling Ruby not to search the rest of arguments for a script file name",
      "takesValue": true,
      "args": [
        {
          "name": "command"
        }
      ]
    },
    {
      "name": "-h",
      "description": "Prints a summary of the options",
      "takesValue": false
    },
    {
      "name": "--help",
      "description": "Prints a summary of the options",
      "takesValue": false
    },
    {
      "name": "-i",
      "description": "Specifies in-place-edit mode. The extension, if specified, is added to old file name to make a backup copy",
      "takesValue": true,
      "args": [
        {
          "name": "extension",
          "isOptional": true
        }
      ]
    },
    {
      "name": "-l",
      "description": "Enables automatic line-ending processing, which means to firstly set $\\ to the value of $/, and secondly chops every line read using chop!",
      "takesValue": false
    },
    {
      "name": "-n",
      "description": "Causes Ruby to assume the following loop around your script",
      "takesValue": false
    },
    {
      "name": "-p",
      "description": "Acts mostly same as -n switch, but print the value of variable $_ at the each end of the loop",
      "takesValue": false
    },
    {
      "name": "-r",
      "description": "Causes Ruby to load the library using require",
      "takesValue": true,
      "args": [
        {
          "name": "library"
        }
      ]
    },
    {
      "name": "-s",
      "description": "Enables some switch parsing for switches after script name but before any file name arguments (or before a --)",
      "takesValue": false
    },
    {
      "name": "-v",
      "description": "Enables verbose mode",
      "takesValue": false
    },
    {
      "name": "--verbose",
      "description": "Enables verbose mode",
      "takesValue": false
    },
    {
      "name": "-w",
      "description": "Enables verbose mode without printing version message at the beginning. It sets the $VERBOSE variable to true",
      "takesValue": false
    },
    {
      "name": "-x",
      "description": "Tells Ruby that the script is embedded in a message. Leading garbage will be discarded until the first that starts with “#!” and contains the string, “ruby”. Any meaningful switches on that line will applied. The end of script must be specified with either EOF, ^D (control-D), ^Z (control-Z), or reserved word __END__. If the directory name is specified, Ruby will switch to that directory before executing script",
      "takesValue": true,
      "args": [
        {
          "name": "directory",
          "template": "folders"
        }
      ]
    },
    {
      "name": "-y",
      "description": "Turns on compiler debug mode. Ruby will print a bunch of internal state messages during compiling scripts. You don't have to specify this switch, unless you are going to debug the Ruby interpreter",
      "takesValue": false
    },
    {
      "name": "--yydebug",
      "description": "Turns on compiler debug mode. Ruby will print a bunch of internal state messages during compiling scripts. You don't have to specify this switch, unless you are going to debug the Ruby interpreter",
      "takesValue": false
    }
  ]
}
