{
  "schemaVersion": 1,
  "name": "python3",
  "description": "Run the python interpreter",
  "options": [
    {
      "name": "-c",
      "description": "Execute the Python code in command. command can be one or more statements separated by newlines, with significant leading whitespace as in normal module code",
      "takesValue": true,
      "args": [
        {
          "name": "command",
          "isVariadic": true,
          "isCommand": true
        }
      ]
    },
    {
      "name": "-m",
      "description": "Search sys.path for the named module and execute its contents as the __main__ module",
      "takesValue": true,
      "args": [
        {
          "name": "command",
          "isVariadic": true,
          "isCommand": true
        }
      ]
    },
    {
      "name": "-h",
      "description": "Print a short description of all command line options",
      "takesValue": false
    },
    {
      "name": "--help",
      "description": "Print a short description of all command line options",
      "takesValue": false
    },
    {
      "name": "-V",
      "description": "Print the Python version number and exit",
      "takesValue": false
    },
    {
      "name": "--version",
      "description": "Print the Python version number and exit",
      "takesValue": false
    },
    {
      "name": "-b",
      "description": "Issue a warning when comparing bytes or bytearray with str or bytes with int. Issue an error when the option is given twice (-bb)",
      "takesValue": false
    },
    {
      "name": "-B",
      "description": "If given, Python won’t try to write .pyc files on the import of source modules",
      "takesValue": false
    },
    {
      "name": "--check-hash-based-pycs",
      "description": "Control the validation behavior of hash-based .pyc files. See Cached bytecode invalidation",
      "takesValue": true,
      "args": [
        {
          "name": "argument",
          "suggestions": [
            {
              "name": "default"
            },
            {
              "name": "always"
            },
            {
              "name": "never"
            }
          ]
        }
      ]
    },
    {
      "name": "-d",
      "description": "Turn on parser debugging output (for expert only, depending on compilation options)",
      "takesValue": false
    },
    {
      "name": "-E",
      "description": "Ignore all PYTHON* environment variables, e.g. PYTHONPATH and PYTHONHOME, that might be set",
      "takesValue": false
    },
    {
      "name": "-i",
      "description": "When a script is passed as first argument or the -c option is used, enter interactive mode after executing the script or the command, even when sys.stdin does not appear to be a terminal",
      "takesValue": false
    },
    {
      "name": "-I",
      "description": "Run Python in isolated mode. This also implies -E and -s. In isolated mode sys.path contains neither the script’s directory nor the user’s site-packages directory",
      "takesValue": false
    },
    {
      "name": "-O",
      "description": "Remove assert statements and any code conditional on the value of __debug__",
      "takesValue": false
    },
    {
      "name": "-OO",
      "description": "Do -O and also discard docstrings",
      "takesValue": false
    },
    {
      "name": "-g",
      "description": "Don’t display the copyright and version messages even in interactive mode",
      "takesValue": false
    },
    {
      "name": "-R",
      "description": "Turn on hash randomization. This option only has an effect if the PYTHONHASHSEED environment variable is set to 0, since hash randomization is enabled by default",
      "takesValue": false
    },
    {
      "name": "-s",
      "description": "Don’t add the user site-packages directory to sys.path",
      "takesValue": false
    },
    {
      "name": "-S",
      "description": "Disable the import of the module site and the site-dependent manipulations of sys.path that it entails",
      "takesValue": false
    },
    {
      "name": "-u",
      "description": "Force the stdout and stderr streams to be unbuffered. This option has no effect on the stdin stream",
      "takesValue": false
    },
    {
      "name": "-v",
      "description": "Print a message each time a module is initialized, showing the place (filename or built-in module) from which it is loaded",
      "takesValue": false
    },
    {
      "name": "-W",
      "description": "Warning control. Python’s warning machinery by default prints warning messages to sys.stderr",
      "takesValue": true,
      "args": [
        {
          "name": "argument"
        }
      ]
    },
    {
      "name": "-x",
      "description": "Skip the first line of the source, allowing use of non-Unix forms of #!cmd. This is intended for a DOS specific hack only",
      "takesValue": false
    },
    {
      "name": "-X",
      "description": "Reserved for various implementation-specific options",
      "takesValue": true,
      "args": [
        {
          "name": "argument",
          "suggestions": [
            {
              "name": "faulthandler"
            },
            {
              "name": "showrefcount"
            },
            {
              "name": "tracemalloc"
            },
            {
              "name": "showalloccount"
            },
            {
              "name": "importtime"
            },
            {
              "name": "dev"
            },
            {
              "name": "utf8"
            },
            {
              "name": "pycache_prefix=PATH"
            }
          ]
        }
      ]
    }
  ],
  "args": [
    {
      "name": "python script",
      "template": "filepaths",
      "extensions": [
        "py",
        "pyw"
      ]
    }
  ]
}
