{
  "schemaVersion": 1,
  "name": "next",
  "description": "Next.js CLI to start, build and export your application",
  "options": [
    {
      "name": "-h",
      "description": "Output usage information",
      "takesValue": false
    },
    {
      "name": "--help",
      "description": "Output usage information",
      "takesValue": false
    },
    {
      "name": "-v",
      "description": "Output the version number",
      "takesValue": false
    },
    {
      "name": "--version",
      "description": "Output the version number",
      "takesValue": false
    }
  ],
  "subcommands": [
    {
      "name": "build",
      "description": "Create an optimized production build of your application",
      "options": [
        {
          "name": "--profile",
          "description": "Enable production profiling",
          "takesValue": false
        },
        {
          "name": "--debug",
          "description": "Enable more verbose build output",
          "takesValue": false
        }
      ],
      "args": [
        {
          "name": "dir",
          "description": "Represent the directory of the Next.js application",
          "isOptional": true,
          "template": "folders"
        }
      ]
    },
    {
      "name": "dev",
      "description": "Start the application in development mode",
      "options": [
        {
          "name": "-p",
          "description": "A port number on which to start the application",
          "takesValue": true,
          "args": [
            {
              "name": "argument"
            }
          ]
        },
        {
          "name": "--port",
          "description": "A port number on which to start the application",
          "takesValue": true,
          "args": [
            {
              "name": "argument"
            }
          ]
        },
        {
          "name": "-H",
          "description": "Hostname on which to start the application",
          "takesValue": true,
          "args": [
            {
              "name": "argument"
            }
          ]
        },
        {
          "name": "--hostname",
          "description": "Hostname on which to start the application",
          "takesValue": true,
          "args": [
            {
              "name": "argument"
            }
          ]
        }
      ],
      "args": [
        {
          "name": "dir",
          "description": "Represent the directory of the Next.js application",
          "isOptional": true,
          "template": "folders"
        }
      ]
    },
    {
      "name": "start",
      "description": "Start the application in production mode",
      "options": [
        {
          "name": "-p",
          "description": "A port number on which to start the application",
          "takesValue": true,
          "args": [
            {
              "name": "argument"
            }
          ]
        },
        {
          "name": "--port",
          "description": "A port number on which to start the application",
          "takesValue": true,
          "args": [
            {
              "name": "argument"
            }
          ]
        },
        {
          "name": "-H",
          "description": "Hostname on which to start the application",
          "takesValue": true,
          "args": [
            {
              "name": "argument"
            }
          ]
        },
        {
          "name": "--hostname",
          "description": "Hostname on which to start the application",
          "takesValue": true,
          "args": [
            {
              "name": "argument"
            }
          ]
        }
      ],
      "args": [
        {
          "name": "dir",
          "description": "Represent the directory of the Next.js application",
          "isOptional": true,
          "template": "folders"
        }
      ]
    },
    {
      "name": "export",
      "description": "Exports the application for production deployment",
      "options": [
        {
          "name": "-s",
          "description": "Do not print any messages to console",
          "takesValue": false
        }
      ],
      "args": [
        {
          "name": "dir",
          "description": "Represent the directory of the Next.js application",
          "isOptional": true,
          "template": "folders"
        }
      ]
    },
    {
      "name": "telemetry",
      "description": "Allows you to control Next.js' telemetry collection",
      "args": [
        {
          "name": "status",
          "description": "Turn Next.js' telemetry collection on or off",
          "suggestions": [
            {
              "name": "enable",
              "description": "Enable Next.js' telemetry collection"
            },
            {
              "name": "disable",
              "description": "Disable Next.js' telemetry collection"
            }
          ]
        }
      ]
    }
  ]
}
