{
  "schemaVersion": 1,
  "name": "ps",
  "description": "Report a snapshot of the current processes",
  "options": [
    {
      "name": "-A",
      "description": "Select all processes",
      "takesValue": false
    },
    {
      "name": "-e",
      "description": "Select all processes",
      "takesValue": false
    },
    {
      "name": "-a",
      "description": "Select all processes except both session leaders",
      "takesValue": true,
      "args": [
        {
          "name": "getsid"
        }
      ]
    },
    {
      "name": "-d",
      "description": "Select all processes except session leaders",
      "takesValue": false
    },
    {
      "name": "--deselect",
      "description": "Select all processes except those that fulfill the specified conditions",
      "takesValue": false
    },
    {
      "name": "-N",
      "description": "Select all processes except those that fulfill the specified conditions (negates the selection)",
      "takesValue": false
    },
    {
      "name": "--pid",
      "description": "Select by process ID",
      "takesValue": true,
      "args": [
        {
          "name": "pidlist"
        }
      ]
    },
    {
      "name": "--ppid",
      "description": "Select by parent process ID. This selects the processes with a parent process ID in pidlist",
      "takesValue": true,
      "args": [
        {
          "name": "pidlist"
        }
      ]
    },
    {
      "name": "--sid",
      "description": "Select by session ID",
      "takesValue": true,
      "args": [
        {
          "name": "sesslist"
        }
      ]
    },
    {
      "name": "--tty",
      "description": "Select by terminal",
      "takesValue": true,
      "args": [
        {
          "name": "ttylist"
        }
      ]
    },
    {
      "name": "-U",
      "description": "Select by real user ID (RUID) or name",
      "takesValue": true,
      "args": [
        {
          "name": "userlist"
        }
      ]
    },
    {
      "name": "-u",
      "description": "Select by effective user ID (EUID) or name",
      "takesValue": true,
      "args": [
        {
          "name": "userlist"
        }
      ]
    },
    {
      "name": "--User",
      "description": "Select by real user ID (RUID) or name",
      "takesValue": true,
      "args": [
        {
          "name": "userlist"
        }
      ]
    },
    {
      "name": "--user",
      "description": "Select by effective user ID (EUID) or name",
      "takesValue": true,
      "args": [
        {
          "name": "userlist"
        }
      ]
    },
    {
      "name": "-c",
      "description": "Show different scheduler information for the -l option",
      "takesValue": false
    },
    {
      "name": "--context",
      "description": "Display security context format (for SE Linux)",
      "takesValue": false
    },
    {
      "name": "-f",
      "description": "Do full-format listing",
      "takesValue": false
    },
    {
      "name": "-F",
      "description": "Extra full format",
      "takesValue": false
    },
    {
      "name": "--format",
      "takesValue": true,
      "args": [
        {
          "name": "format"
        }
      ]
    },
    {
      "name": "-o",
      "takesValue": true,
      "args": [
        {
          "name": "format"
        }
      ]
    },
    {
      "name": "-M",
      "description": "(for SE Linux)",
      "takesValue": false
    },
    {
      "name": "-y",
      "takesValue": false
    },
    {
      "name": "-l",
      "takesValue": false
    },
    {
      "name": "--cols",
      "description": "Set screen width",
      "takesValue": true,
      "args": [
        {
          "name": "n"
        }
      ]
    },
    {
      "name": "--columns",
      "description": "Set screen width",
      "takesValue": true,
      "args": [
        {
          "name": "n"
        }
      ]
    },
    {
      "name": "--cumulative",
      "description": "Include some dead child process data (as a sum with the parent)",
      "takesValue": false
    },
    {
      "name": "--forest",
      "description": "ASCII art process tree",
      "takesValue": false
    },
    {
      "name": "-H",
      "description": "Show process hierarchy (forest)",
      "takesValue": false
    },
    {
      "name": "--headers",
      "description": "Repeat header lines, one per page of output",
      "takesValue": false
    },
    {
      "name": "-n",
      "description": "Set namelist file",
      "takesValue": true,
      "args": [
        {
          "name": "namelist"
        }
      ]
    },
    {
      "name": "--lines",
      "description": "Set screen height",
      "takesValue": true,
      "args": [
        {
          "name": "n"
        }
      ]
    },
    {
      "name": "--no-headers",
      "description": "Print no header line at all",
      "takesValue": false
    },
    {
      "name": "--no-heading",
      "description": "Print no header line at all",
      "takesValue": false
    },
    {
      "name": "--rows",
      "description": "Set screen height",
      "takesValue": true,
      "args": [
        {
          "name": "n"
        }
      ]
    },
    {
      "name": "--sort",
      "description": "Specify sorting order",
      "takesValue": true,
      "args": [
        {
          "name": "spec"
        }
      ]
    },
    {
      "name": "--width",
      "description": "Set screen width",
      "takesValue": true,
      "args": [
        {
          "name": "n"
        }
      ]
    },
    {
      "name": "-L",
      "description": "Show threads, possibly with LWP and NLWP columns",
      "takesValue": false
    },
    {
      "name": "-T",
      "description": "Show threads, possibly with SPID column",
      "takesValue": false
    },
    {
      "name": "--help",
      "description": "Print a help message",
      "takesValue": false
    },
    {
      "name": "--info",
      "description": "Print debugging info",
      "takesValue": false
    },
    {
      "name": "--version",
      "description": "Print the procps version",
      "takesValue": false
    }
  ]
}
