{
  "schemaVersion": 1,
  "name": "watchman",
  "description": "A file watching service",
  "options": [
    {
      "name": "--help",
      "description": "Show help for watchman",
      "takesValue": false
    },
    {
      "name": "-h",
      "description": "Show help for watchman",
      "takesValue": false
    },
    {
      "name": "--inetd",
      "description": "Spawning from an inetd style supervisor",
      "takesValue": false
    },
    {
      "name": "-S",
      "description": "Don't use the site or system spawner",
      "takesValue": false
    },
    {
      "name": "--no-site-spawner",
      "description": "Don't use the site or system spawner",
      "takesValue": false
    },
    {
      "name": "-v",
      "description": "Show version number for watchman",
      "takesValue": false
    },
    {
      "name": "--version",
      "description": "Show version number for watchman",
      "takesValue": false
    },
    {
      "name": "--named-pipe-path",
      "description": "Specify alternate named pipe path",
      "takesValue": true,
      "args": [
        {
          "name": "path",
          "description": "The alternate named pipe path"
        }
      ]
    },
    {
      "name": "-u",
      "description": "Specify alternate unix domain socket path",
      "takesValue": true,
      "args": [
        {
          "name": "path",
          "description": "The alternate unix domain socket path"
        }
      ]
    },
    {
      "name": "--unix-listener-path",
      "description": "Specify alternate unix domain socket path",
      "takesValue": true,
      "args": [
        {
          "name": "path",
          "description": "The alernate unix domain socket path"
        }
      ]
    },
    {
      "name": "-o",
      "description": "Specify the path to logfile",
      "takesValue": true,
      "args": [
        {
          "name": "path",
          "description": "The path to logfile"
        }
      ]
    },
    {
      "name": "--logfile",
      "description": "Specify the path to logfile",
      "takesValue": true,
      "args": [
        {
          "name": "path",
          "description": "The path to logfile"
        }
      ]
    },
    {
      "name": "--log-level",
      "description": "Set the log level",
      "takesValue": true,
      "args": [
        {
          "name": "level",
          "description": "The log level",
          "suggestions": [
            {
              "name": "0"
            },
            {
              "name": "1"
            },
            {
              "name": "2"
            }
          ]
        }
      ]
    },
    {
      "name": "--pidfile",
      "description": "Specify path to pidfile",
      "takesValue": false
    },
    {
      "name": "-p",
      "description": "Persist and wait for further responses",
      "takesValue": false
    },
    {
      "name": "--persistent",
      "description": "Persist and wait for further responses",
      "takesValue": false
    },
    {
      "name": "-n",
      "description": "Don't save state between invocations",
      "takesValue": false
    },
    {
      "name": "--no-save-state",
      "description": "Don't save state between invocations",
      "takesValue": false
    },
    {
      "name": "--statefile",
      "description": "Specify path to file to hold watch and trigger state",
      "takesValue": true,
      "args": [
        {
          "name": "path",
          "description": "The path to file to hold watch and trigger state"
        }
      ]
    },
    {
      "name": "-j",
      "description": "Instead of parsing CLI arguments, take a single json object from stdin",
      "takesValue": false
    },
    {
      "name": "--json-command",
      "description": "Instead of parsing CLI arguments, take a single json object from stdin",
      "takesValue": false
    },
    {
      "name": "--output-encoding",
      "description": "CLI output encoding",
      "takesValue": true,
      "args": [
        {
          "name": "encoding",
          "description": "The output encoding",
          "suggestions": [
            {
              "name": "json"
            },
            {
              "name": "bser"
            }
          ]
        }
      ]
    },
    {
      "name": "--server-encoding",
      "description": "CLI<->server encoding",
      "takesValue": true,
      "args": [
        {
          "name": "encoding",
          "description": "The server encoding",
          "suggestions": [
            {
              "name": "bser"
            },
            {
              "name": "json"
            }
          ]
        }
      ]
    },
    {
      "name": "-f",
      "description": "Run the service in the foreground",
      "takesValue": false
    },
    {
      "name": "--foreground",
      "description": "Run the service in the foreground",
      "takesValue": false
    },
    {
      "name": "--no-pretty",
      "description": "Don't pretty print JSON",
      "takesValue": false
    },
    {
      "name": "--no-spawn",
      "description": "Don't try to start the service if it is not available",
      "takesValue": false
    },
    {
      "name": "--no-local",
      "description": "When no-spawn is enabled, don't try to handle request in client mode if service is unavailable",
      "takesValue": false
    }
  ],
  "subcommands": [
    {
      "name": "clock",
      "description": "Returns the current clock value for a watched root",
      "args": [
        {
          "name": "path",
          "description": "The path to directory",
          "template": "folders"
        }
      ]
    },
    {
      "name": "find",
      "description": "Finds all files that match the optional list of patterns under the specified dir",
      "args": [
        {
          "name": "path",
          "description": "The path to directory",
          "isVariadic": true,
          "template": "folders"
        }
      ]
    },
    {
      "name": "flush-subscriptions",
      "description": "This is designed to be used by interactive programs that have a background process or daemon maintaining a subscription to Watchman"
    },
    {
      "name": "get-config",
      "description": "Returns the .watchmanconfig for the root",
      "subcommands": [
        {
          "name": "path",
          "description": "The path to root"
        }
      ]
    },
    {
      "name": "get-sockname",
      "description": "Get socket path"
    },
    {
      "name": "list-capabilities",
      "description": "Returns the full list of supported capabilities offered by the watchman server"
    },
    {
      "name": "log",
      "description": "Generates a log line in the watchman log",
      "args": [
        {
          "name": "level",
          "description": "The log level",
          "suggestions": [
            {
              "name": "debug"
            },
            {
              "name": "error"
            },
            {
              "name": "off"
            }
          ]
        }
      ]
    },
    {
      "name": "log-level",
      "description": "Changes the log level of your connection to the watchman service",
      "args": [
        {
          "name": "level",
          "description": "The log level",
          "suggestions": [
            {
              "name": "debug"
            },
            {
              "name": "error"
            },
            {
              "name": "off"
            }
          ]
        }
      ]
    },
    {
      "name": "query",
      "description": "Executes a query against the specified root"
    },
    {
      "name": "shutdown-server",
      "description": "This causes your watchman service to exit with a normal status code"
    },
    {
      "name": "since",
      "description": "Finds all files that were modified since the specified clockspec that match the optional list of patterns",
      "args": [
        {
          "name": "path",
          "description": "The path to directory",
          "template": "folders"
        }
      ]
    },
    {
      "name": "state-enter",
      "description": "This causes a watch to be marked as being in a particular named state"
    },
    {
      "name": "state-leave",
      "description": "This causes a watch to no longer be marked as being in a particular named state"
    },
    {
      "name": "subscribe",
      "description": "Subscribes to changes against a specified root and requests that they be sent to the client via its connection"
    },
    {
      "name": "trigger",
      "description": "This will create or replace a trigger",
      "args": [
        {
          "name": "path",
          "description": "The path to directory",
          "template": "folders"
        }
      ]
    },
    {
      "name": "trigger-del",
      "description": "Deletes a named trigger from the list of registered triggers"
    },
    {
      "name": "trigger-list",
      "description": "Returns the set of registered triggers associated with a root directory"
    },
    {
      "name": "unsubscribe",
      "description": "Cancels a named subscription against the specified root"
    },
    {
      "name": "version",
      "description": "The version and build information for the currently running watchman service"
    },
    {
      "name": "watch-del",
      "description": "Removes a watch and any associated triggers",
      "args": [
        {
          "name": "path",
          "description": "The path to directory",
          "template": "folders"
        }
      ]
    },
    {
      "name": "watch-del-all",
      "description": "Removes all watches and associated triggers"
    },
    {
      "name": "watch-list",
      "description": "Returns a list of watched dirs"
    },
    {
      "name": "watch-project",
      "description": "Requests that the project containing the requested dir is watched for changes"
    }
  ]
}
